{
  "active_release_id": "g00000002",
  "candidate_ref": "candidate/run-30765244585-attempt-1",
  "content_commit_sha": "b132e35e24326ec4c43fa5d76c532286236aa0d2",
  "content_identity": {
    "workflow_run_attempt": 1,
    "workflow_run_id": "30765244585"
  },
  "counts": {
    "current_live_channels": 2,
    "current_open_license": 0,
    "current_public_unverified": 2,
    "current_restricted": 0,
    "current_takedown": 0,
    "current_unknown": 0,
    "current_verified": 0,
    "current_vod_sites": 1,
    "previous_live_channels": 2,
    "previous_open_license": 0,
    "previous_public_unverified": 2,
    "previous_restricted": 0,
    "previous_takedown": 0,
    "previous_unknown": 0,
    "previous_verified": 0,
    "previous_vod_sites": 1
  },
  "due": true,
  "failures": {
    "credential_query_rejected": 12,
    "response_too_large": 1
  },
  "finished_at": "2026-08-02T20:17:33Z",
  "forced": false,
  "gate": {
    "historical_deletions": [],
    "inconclusive": false,
    "inputs": {
      "current_healthy_live_urls": 2,
      "current_live_channels": 2,
      "current_publishable_vod_items": 1,
      "current_vod_sites": 1,
      "failed_network_groups": 0,
      "previous_live_urls": 2,
      "previous_vod_items": 1
    },
    "mandatory_removal_ids": [],
    "network_probes": [
      {
        "attempts": 1,
        "detail": "ok",
        "elapsed_ms": 281,
        "group": "cloudflare_http",
        "passed": true
      },
      {
        "attempts": 2,
        "detail": "ok",
        "elapsed_ms": 250,
        "group": "dns_public",
        "passed": true
      },
      {
        "attempts": 1,
        "detail": "ok",
        "elapsed_ms": 537,
        "group": "github_raw",
        "passed": true
      },
      {
        "attempts": 1,
        "detail": "ok",
        "elapsed_ms": 256,
        "group": "google_http",
        "passed": true
      }
    ],
    "publish": true,
    "reasons": [],
    "release_kind": "regular",
    "thresholds": {
      "failed_groups_to_abort": 2,
      "max_new_failure_ratio": 0.2,
      "minimum_live_channels": 1,
      "minimum_previous_items": 5,
      "minimum_vod_sites": 1
    }
  },
  "generation": 2,
  "previous_release_head_sha": "44c4eabe9980ef2e8c99e836465b1e01c57b4ead",
  "recovery_due": false,
  "release_kind": "regular",
  "schema_version": "1.0.0",
  "sources": [
    {
      "change_summary": {
        "category": "unchanged",
        "current": {
          "publication_status": "stable",
          "rights_status": "public_unverified",
          "technical_status": "healthy"
        },
        "previous": {
          "publication_status": "stable",
          "rights_status": "public_unverified",
          "technical_status": "healthy"
        }
      },
      "failure_reason": null,
      "publication_status": "stable",
      "rights_status": "public_unverified",
      "secondary_reasons": [],
      "source_id": "ikun-vod",
      "technical_status": "healthy",
      "upstream_revision": null
    },
    {
      "change_summary": {
        "category": "unchanged",
        "current": {
          "publication_status": "stable",
          "rights_status": "public_unverified",
          "technical_status": "healthy"
        },
        "previous": {
          "publication_status": "stable",
          "rights_status": "public_unverified",
          "technical_status": "healthy"
        }
      },
      "failure_reason": null,
      "publication_status": "stable",
      "rights_status": "public_unverified",
      "secondary_reasons": [],
      "source_id": "iptv-org-cn-cctv",
      "technical_status": "healthy",
      "upstream_revision": "23852209ad9e4e35400730a4f6f4e4cf946f3070"
    }
  ],
  "started_at": "2026-08-02T20:16:46Z",
  "status": "success",
  "workflow_run_attempt": 1,
  "workflow_run_id": "30765244585"
}
